{
  "schema_version": 1,
  "name": "release-notes-review",
  "inputs": {
    "type": "object",
    "properties": {
      "summary": {"type": "string", "minLength": 1, "maxLength": 200},
      "severity": {"type": "integer", "minimum": 1, "maximum": 5},
      "confidence": {"type": "number", "minimum": 0, "maximum": 1},
      "breaking": {"type": "boolean"},
      "tickets": {
        "type": "array",
        "items": {"type": "string", "minLength": 1},
        "minItems": 1,
        "maxItems": 50
      },
      "metadata": {
        "type": "object",
        "properties": {
          "team": {"type": "string", "minLength": 1},
          "area": {"type": "string", "minLength": 1}
        },
        "required": ["team"],
        "additionalProperties": false
      }
    },
    "required": ["summary", "severity", "confidence", "breaking", "tickets", "metadata"],
    "additionalProperties": false
  },
  "checks": [
    {
      "id": "notes-complete",
      "name": "The release notes identify the owning team",
      "using": ["summary", "metadata"],
      "question": "Do the notes name the team that owns the change?",
      "answers": {
        "yes": "The notes name the owning team.",
        "no": "The notes do not name the owning team."
      },
      "accept": "yes"
    },
    {
      "id": "summary-free-of-todos",
      "name": "The summary carries no open work marker",
      "using": ["summary"],
      "rule": {"excludes": "TODO"}
    }
  ]
}
